{
  "$schema": "https://json-schema.org/draft/2020-12/schema",
  "$id": "https://devai.nyxk.com.br/schemas/adopter-policy.schema.json",
  "title": "DEVAI Adopter Policy",
  "description": "Validated adopter-owned policy source merged into DEVAI's resolved project configuration without replacing core policy domains.",
  "type": "object",
  "additionalProperties": false,
  "required": ["schemaVersion", "policy_id", "policy_version"],
  "properties": {
    "schemaVersion": { "const": "1.0.0" },
    "policy_id": { "type": "string", "pattern": "^[a-z][a-z0-9.-]+$" },
    "policy_version": { "type": "string", "pattern": "^[0-9]+\\.[0-9]+\\.[0-9]+$" },
    "project": {
      "type": "object",
      "additionalProperties": false,
      "properties": {
        "project_type": {
          "enum": ["runtime-host", "platform-package", "docs-archive", "framework"]
        },
        "repo": {
          "type": "object",
          "additionalProperties": false,
          "required": ["kind"],
          "properties": { "kind": { "enum": ["library", "application"] } }
        },
        "docs": {
          "$ref": "project-config.schema.json#/properties/docs",
          "description": "Documentation configuration uses the same closed shape accepted by the resolved adopter project configuration."
        }
      }
    },
    "ci_economy": {
      "$ref": "project-config.schema.json#/properties/ci_economy",
      "description": "Optional CI-economy policy materialized into the adopter project configuration."
    },
    "sensor_inputs": {
      "$ref": "sensor-inputs.schema.json",
      "description": "Optional complete sensor input projection, owned and digest-bound by init bind --adopter-policy under ADR-SCR-0015. Absence preserves an unmanaged target; removal after verified prior ownership retires overrides to the installed canonical defaults."
    },
    "invariant_producers": {
      "$ref": "invariant-producers.schema.json",
      "description": "Complete optional exact invariant/task/result obligations, projected to .devai/config/invariant-producers.json through registered adopter binding and whole-file ownership receipts (ADR-SCR-0017)."
    },
    "reviewed_workflow_steps": {
      "$ref": "reviewed-workflow-steps.schema.json",
      "description": "Complete optional reviewed adopter workflow effects, projected to .devai/config/reviewed-workflow-steps.json through registered adopter binding; exact executable closure validation remains mandatory (ADR-SCR-0017)."
    },
    "release_verification": { "$ref": "release-verification-profile.schema.json" },
    "domains": {
      "type": "object",
      "additionalProperties": false,
      "required": ["client"],
      "properties": {
        "client": {
          "type": "array",
          "uniqueItems": true,
          "items": { "type": "string", "pattern": "^[A-Z][A-Z0-9_-]*$" }
        }
      }
    },
    "thresholds": { "type": "object", "additionalProperties": true },
    "scorecard_na": { "$ref": "scorecard-na-config.schema.json" },
    "glob_guards": { "$ref": "glob-guards.schema.json" },
    "documentation_implementation": {
      "type": "object",
      "additionalProperties": false,
      "required": ["files"],
      "description": "Exact-file core specialization under ADR-AUT-0010. Schema validity alone grants no authority. The package-owned compiler requires the exact supported constitution capability, canonical executable paths, protected-class exclusion, and registered digest-bound materialization.",
      "properties": {
        "files": {
          "type": "array",
          "minItems": 1,
          "uniqueItems": true,
          "items": { "type": "string", "minLength": 1 },
          "description": "Finite exact repository-relative executable implementation paths under docs/. No glob, directory grant, inferred membership, protected test or architectural-specification path is admitted. Canonical grammar and overlap checks are enforced by the shared compiler."
        }
      }
    },
    "authority": {
      "type": "object",
      "additionalProperties": false,
      "required": ["roots"],
      "description": "Optional adopter path-authority extension admitted by Constitution 1.0.2 Article 6 (ADR-GOV-0024) and declared by ADR-AUT-0003: explicitly declared roots under a fixed class ladder, architecture over test over the Engineer root remainder. Materialized only through init bind --adopter-policy and refused while the bound constitution is below 1.0.2.",
      "properties": {
        "extension_id": {
          "type": "string",
          "pattern": "^[a-z][a-z0-9.-]+$",
          "description": "Identifier of the compiled additive extension; defaults to <policy_id>.path-authority and must differ from devai-adopter-authority."
        },
        "roots": {
          "type": "array",
          "minItems": 1,
          "uniqueItems": true,
          "items": { "type": "string", "pattern": "^[A-Za-z0-9_][A-Za-z0-9_.-]*$" },
          "description": "Single path segments declared explicitly: no separator, no dot segment, no glob metacharacter, never equal to or a prefix of a core-table row, and no root a prefix of another."
        },
        "classes": {
          "type": "object",
          "additionalProperties": false,
          "description": "The two path classes of the fixed ladder. test is optional and defaults to the package selectors in law/policy/adopter-defaults/path-authority-classes.json; architecture has no default.",
          "properties": {
            "test": {
              "type": "object",
              "additionalProperties": false,
              "required": ["selectors"],
              "description": "Inspector class at precedence 700: test directories and colocated test files under each root.",
              "properties": {
                "selectors": {
                  "type": "array",
                  "uniqueItems": true,
                  "items": { "type": "string", "minLength": 1 },
                  "description": "Root-relative minimatch globs applied under every declared root; never absolute, never starting with a root segment, and free of .., backslashes, braces, and extglobs."
                }
              }
            },
            "architecture": {
              "type": "object",
              "additionalProperties": false,
              "required": ["selectors"],
              "description": "Architect class at precedence 750: schema definitions, blueprints, and the architectural specifications the adopter names under each root.",
              "properties": {
                "selectors": {
                  "type": "array",
                  "uniqueItems": true,
                  "items": { "type": "string", "minLength": 1 },
                  "description": "Root-relative minimatch globs applied under every declared root; never absolute, never starting with a root segment, and free of .., backslashes, braces, and extglobs."
                }
              }
            }
          }
        }
      }
    }
  },
  "schema_version": "1.0.0",
  "examples": [
    {
      "schemaVersion": "1.0.0",
      "policy_id": "teat.devai-adoption",
      "policy_version": "1.0.0"
    },
    {
      "schemaVersion": "1.0.0",
      "policy_id": "detran.devai-adoption",
      "policy_version": "1.1.0",
      "authority": {
        "extension_id": "detran.path-authority",
        "roots": ["apps", "backend", "frontend", "mobile", "portal", "src"],
        "classes": {
          "test": { "selectors": ["**/*.spec.*", "**/*.test.*", "**/test/**", "**/tests/**"] },
          "architecture": { "selectors": ["**/ddl/**/*.sql", "**/blueprints/**"] }
        }
      }
    }
  ]
}
